{"type":"config","name":"trajectory-roi-clustering","metricName":"roi_quality","metricUnit":"score","bestDirection":"higher","seeds":1,"phase":"explore"}
{"run":1,"commit":"5b15155","metric":88.92,"metric_std":0,"metrics":{"n_rois":2,"total_vertices":16,"overlap_area_pct":0.0,"coverage_pct":82.28,"separation_px":6.71,"area_ratio":0.432},"status":"keep","description":"baseline: buffered union 30px + subtraction","timestamp":1776225548,"segment":0,"phase":"explore","seeds_run":1,"per_seed":[88.92]}
{"run":2,"commit":"fee0461","metric":92.96,"metric_std":0,"metrics":{"n_rois":2,"total_vertices":16,"overlap_area_pct":0.0,"coverage_pct":80.38,"separation_px":33.05,"area_ratio":0.236},"status":"keep","description":"concave hull ratio=0.3 + 15px buffer + decision boundary","timestamp":1776225651,"segment":0,"phase":"explore","seeds_run":1,"per_seed":[92.96]}
{"run":3,"commit":"ca4ff58","metric":93.76,"metric_std":0,"metrics":{"n_rois":2,"total_vertices":16,"overlap_area_pct":0.0,"coverage_pct":81.65,"separation_px":16.7,"area_ratio":0.36},"status":"keep","description":"concave hull ratio=0.5 + 25px buffer","timestamp":1776225676,"segment":0,"phase":"explore","seeds_run":1,"per_seed":[93.76]}
{"run":4,"commit":"b2e83ad","metric":96.15,"metric_std":0,"metrics":{"n_rois":2,"total_vertices":13,"overlap_area_pct":0.0,"coverage_pct":84.73,"separation_px":19.93,"area_ratio":0.479},"status":"keep","description":"trail points + pre-clip + 10px boundary margin, concave_hull ratio=0.5 buffer=25px","timestamp":1776226453,"segment":0,"phase":"explore","seeds_run":1,"per_seed":[96.15]}
{"run":3,"commit":"b2e83ad","metric":86.37,"metric_std":0,"metrics":{"n_rois":2,"total_vertices":12,"overlap_area_pct":0.0,"coverage_pct":85.5,"separation_px":0.0},"status":"discard","description":"trail points without boundary margin (0 separation)","timestamp":1776226453,"segment":0,"phase":"explore","seeds_run":1,"per_seed":[86.37]}
{"run":5,"commit":"b2e83ad","metric":96.15,"metric_std":0,"metrics":{"n_rois":2,"total_vertices":13,"overlap_area_pct":0.0,"coverage_pct":84.73,"separation_px":19.93},"status":"discard","description":"IQR factor=2.0 (no change)","timestamp":1776227020,"segment":0,"phase":"explore","seeds_run":1,"per_seed":[96.15]}
{"run":6,"commit":"b2e83ad","metric":96.15,"metric_std":0,"metrics":{"n_rois":2,"total_vertices":13,"overlap_area_pct":0.0,"coverage_pct":84.73,"separation_px":19.93},"status":"discard","description":"oriented bounding rect for small groups (threshold never hit)","timestamp":1776227020,"segment":0,"phase":"explore","seeds_run":1,"per_seed":[96.15]}
{"run":7,"commit":"ab0cd79","metric":96.79,"metric_std":0,"metrics":{"n_rois":2,"total_vertices":13,"overlap_area_pct":0.0,"coverage_pct":87.16,"separation_px":20.03,"area_ratio":0.565},"status":"keep","description":"10 trail points per vehicle (denser point cloud)","timestamp":1776227358,"segment":0,"phase":"explore","seeds_run":1,"per_seed":[96.79]}
{"run":8,"commit":"ab0cd79","metric":96.43,"metric_std":0,"metrics":{"n_rois":2,"total_vertices":13,"overlap_area_pct":0.0,"coverage_pct":85.71,"separation_px":35.12,"area_ratio":0.414},"status":"discard","description":"all trail points (50/vehicle) — too dense, concave hull oversimplifies","timestamp":1776227697,"segment":0,"phase":"explore","seeds_run":1,"per_seed":[96.43]}
{"type":"phase","phase":"consolidate","run":12,"timestamp":1776228559}
